<!DOCTYPE rdn SYSTEM "rdn.dtd">

<!-- Part of the open-source Proximity system (see LICENSE for
     copyright and license information).
-->

<rdn>
    <rpt-files>
        <file>ProxWebKB_RPTforRDN.xml</file>
    </rpt-files>
    <item-maps>
        <map>
            <from>core_page</from>
            <to>linked_to_page</to>
        </map>
        <map>
            <from>core_page</from>
            <to>linked_from_page</to>
        </map>
    </item-maps>
</rdn>
