<!DOCTYPE rdn SYSTEM "rdn.dtd">

<!--
    Part of the open-source Proximity system
   (see LICENSE for copyright and license information).
-->
<rdn>
    <rpt-files>
        <file>t5-actor-gender.xml</file>
        <file>t5-actor-hasAward.xml</file>
        <file>t5-movie-genre.xml</file>
        <file>t5-movie-isOWBlockbuster.xml</file>
    </rpt-files>
    <item-maps>
        <map>
            <from>movie</from>
            <to>actor_movie</to>
        </map>
    </item-maps>
</rdn>
